{
  "id": "adf-to-md.basic.paragraph",
  "direction": "adf-to-md",
  "description": "Converts a simple ADF paragraph to Markdown.",
  "profile": "portableMarkdown",
  "options": {
    "markdownDialect": "gfm"
  },
  "features": ["paragraph", "text"],
  "expectedLoss": false,
  "skip": {},
  "xfail": {}
}
