{
  "id": "md-to-adf.phase1.list-item-heading-demotion",
  "direction": "md-to-adf",
  "description": "Demotes ATX heading lines inside indented list-item continuations to bold paragraphs, since ADF listItem content cannot contain heading nodes.",
  "profile": "portableMarkdown",
  "options": {
    "markdownDialect": "gfm"
  },
  "features": [
    "orderedList",
    "listItem",
    "paragraph",
    "text",
    "strong",
    "headingDemotion"
  ],
  "expectedLoss": true,
  "skip": {},
  "xfail": {}
}
