{
  "id": "adf-to-md.phase1.escaping",
  "direction": "adf-to-md",
  "description": "Escapes Markdown punctuation in Phase 1 text output.",
  "profile": "portableMarkdown",
  "options": {
    "markdownDialect": "gfm"
  },
  "features": ["paragraph", "text"],
  "expectedLoss": false,
  "skip": {},
  "xfail": {
    "python": "Conversion logic is not implemented in the bootstrap skeleton."
  }
}
